{
  "workflow_id": "WF-us-v1",
  "project_id": "us",
  "version": 1,
  "status": "compiled",
  "steps": [
    {
      "id": "T1",
      "title": "Classify this session as Path C knowledge-use, not a client hunt",
      "coverage": "have hive skill"
    },
    {
      "id": "T2",
      "title": "File graph + patterns from atoms (this compile)",
      "coverage": "need knowledge"
    },
    {
      "id": "T3",
      "title": "Wiki-ingest pointer: raw→index→log, do not dump 147",
      "coverage": "need knowledge"
    },
    {
      "id": "T4",
      "title": "Sanitize-in / check-out on any outbound draft",
      "coverage": "need knowledge"
    },
    {
      "id": "T5",
      "title": "Pick at most one Path C ship later (click-live OR paid-slice)",
      "coverage": "HITL only"
    }
  ],
  "pattern_ids": [
    "P-wiki-raw-index-log",
    "P-sanitize-then-check-pass-neq-send",
    "P-own-os-before-outbound",
    "P-tape-dollars-unverified",
    "P-inbound-from-demonstrated-build"
  ],
  "support_ids": [
    "K-0WDkwMxj13s-02",
    "K-0YXjEzFfft8-03",
    "K-2J3uX8iRNng-02",
    "K-3TdD8Qv5Tk8-03",
    "K-5IM27lbCwjM-01",
    "K-8C6iCpJ9HPo-01",
    "K-8MEJen0nblQ-01",
    "K-8ktcSaSTvxk-02",
    "K-AO5aW01DKHo-03",
    "K-B4p9O2P2a3c-03"
  ],
  "dissent_ids": [
    "K--cdexJWN8YA-06",
    "K-0YXjEzFfft8-04",
    "K-0YXjEzFfft8-06",
    "K-3XIGcM7VICc-06",
    "K-8MEJen0nblQ-04",
    "K-8QQ_INxAhRs-05",
    "K-B4p9O2P2a3c-05",
    "K-irg-2IfAjpo-04",
    "K-jZgcWCzxh1I-06",
    "K-jdbOVepEtUE-04",
    "K-x-2088007687149601254-01",
    "K-x-2088007687149601254-03"
  ],
  "provenance": "WORKFLOW → PATTERN → ATOMS → TRANSCRIPT",
  "audits": {
    "coverage": "pass",
    "context_misuse": "pass",
    "contradiction": "pass"
  }
}
